{"code":"p06","name":"手绘线框艺术风","description":"暖白底手绘线条边框，陶土橙点缀，适合插画师与艺术指导。","schema":{"type":"object","required":["name"],"properties":{"name":{"type":"string"},"title":{"type":"string"},"phone":{"type":"string"},"email":{"type":"string"},"location":{"type":"string"},"linkedin":{"type":"string"},"website":{"type":"string"},"summary":{"type":"string"},"experiences":{"type":"array","items":{"type":"object","properties":{"company":{"type":"string"},"role":{"type":"string"},"date":{"type":"string"},"location":{"type":"string"},"bullets":{"type":"array","items":{"type":"string"}}}}},"education":{"type":"array","items":{"type":"object","properties":{"school":{"type":"string"},"degree":{"type":"string"},"date":{"type":"string"},"location":{"type":"string"}}}},"skills":{"type":"array","items":{"type":"object","properties":{"category":{"type":"string"},"items":{"type":"array","items":{"type":"string"}}}}},"projects":{"type":"array","items":{"type":"object","properties":{"projectName":{"type":"string"},"projectRole":{"type":"string"},"projectDate":{"type":"string"},"stack":{"type":"string"},"bullets":{"type":"array","items":{"type":"string"}}}}},"certifications":{"type":"array","items":{"type":"object","properties":{"certName":{"type":"string"},"certDate":{"type":"string"}}}},"languages":{"type":"array","items":{"type":"string"}},"awards":{"type":"array","items":{"type":"object","properties":{"awardName":{"type":"string"},"awardDate":{"type":"string"}}}},"tags":{"type":"array","items":{"type":"string"}},"interests":{"type":"string"}}},"html":"<div class=\"resume\">\n  <div class=\"hand-drawn-border\"></div>\n  <div class=\"main-content\">\n    \n    <div class=\"name-section\">\n      <div><h1 class=\"name\">{{name}}</h1><span class=\"title-sub\">{{title}}</span></div>\n      <div class=\"contact-row\">\n        <div class=\"contact-item\"><span class=\"contact-icon\">✆</span>{{phone}}</div>\n        <div class=\"contact-item\"><span class=\"contact-icon\">✉</span>{{email}}</div>\n        <div class=\"contact-item\"><span class=\"contact-icon\">🌐</span>{{website}}</div>\n        <div class=\"contact-item\"><span class=\"contact-icon\">📍</span>{{location}}</div>\n      </div>\n    </div>\n    <div><p class=\"summary\">{{summary}}</p></div>\n    <div>\n      <h2 class=\"section-title\">专业经历</h2>\n      {{#each experiences}}<div class=\"entry\">\n        <div class=\"entry-header\"><span><span class=\"institution\">{{company}}</span> <span class=\"job-title\">/ {{role}}</span></span><span class=\"date-location\">{{date}} | {{location}}</span></div>\n        <div class=\"description\">{{#each bullets}}<div class=\"desc-item\">{{.}}</div>{{/each}}</div>\n      </div>{{/each}}\n    </div>\n    <div>\n      <h2 class=\"section-title\">教育</h2>\n      {{#each education}}<div class=\"entry\">\n        <div class=\"entry-header\"><span><span class=\"institution\">{{school}}</span> <span class=\"job-title\">/ {{degree}}</span></span><span class=\"date-location\">{{date}} | {{location}}</span></div>\n      </div>{{/each}}\n    </div>\n    <div>\n      <h2 class=\"section-title\">核心能力</h2>\n      <div class=\"two-columns\">{{#each skills}}<div class=\"column-item\"><strong>{{category}}</strong>{{#each items}}<span class=\"skill-value\">{{.}}</span>{{/each}}</div>{{/each}}</div>\n    </div>\n    <div>\n      <h2 class=\"section-title\">合作品牌 &amp; 项目</h2>\n      <div class=\"skill-tags\">{{#each tags}}<span class=\"skill\">{{.}}</span>{{/each}}</div>\n    </div>\n    <div>\n      <h2 class=\"section-title\">出版物 &amp; 个人项目</h2>\n      {{#each projects}}<div class=\"pub-item\"><span class=\"pub-name\">{{projectName}}</span><span class=\"pub-role\">{{projectRole}}</span></div>{{/each}}\n      <div class=\"award-line\">{{#each awards}}<span class=\"award\">🏆 {{awardName}} {{awardDate}}</span>{{/each}}</div>\n    </div>\n    <div class=\"footer-note\">\n      <span>作品集网站: <span class=\"link-text\">{{website}}</span></span>\n      <span>Behance: {{linkedin}}</span>\n    </div>\n  </div>\n</div>","css":".resume{--page-width: 210mm;\n      --page-height: 297mm;\n      --bg-main: #FFFFFF;\n      --text-primary: #2E2E2C;\n      --text-secondary: #4B4B4B;\n      --text-muted: #5F5F5D;\n      --accent-burnt-orange: #C26A4B;\n      --accent-soft-terracotta: #D98C6B;\n      --line-light: #EAE6E1;\n      --line-soft: #D9D2C7;\n      --surface-warm: #FDF9F5;\n      --highlight-cream: #FEF7F2;\n      --shadow-subtle: 0 4px 10px rgba(0,0,0,0.03);}\n.hand-drawn-border{position: absolute;\n      top: 18px;\n      left: 18px;\n      right: 18px;\n      bottom: 18px;\n      border: 1.2px solid #D8CFC4;\n      border-radius: 2px 80% 2px 80% / 2px 85% 2px 85%;\n      pointer-events: none;\n      opacity: 0.7;\n      z-index: 1;}\n.main-content{position: relative;\n      z-index: 5;\n      padding: 2.2rem 2.4rem 2rem 2.4rem;\n      background: transparent;}\n.resume h1, .resume h2, .resume h3, .resume p, .resume span, .resume li, .resume div{font-weight: normal;\n      color: inherit;}\n.name-section{margin-bottom: 1.5rem;\n      border-bottom: 1.8px dashed var(--accent-burnt-orange);\n      padding-bottom: 1.2rem;\n      display: flex;\n      flex-wrap: wrap;\n      align-items: baseline;\n      justify-content: space-between;}\n.name{font-size: 2.8rem;\n      font-family: 'Helvetica Neue', 'Arial', '思源黑体', sans-serif;\n      font-weight: 350;\n      letter-spacing: 0.04em;\n      color: #2B2A28;\n      line-height: 1.1;\n      margin-right: 1rem;}\n.title-sub{font-size: 1.1rem;\n      font-weight: 380;\n      color: var(--accent-burnt-orange);\n      letter-spacing: 0.5px;\n      font-family: 'Arial', 'Helvetica Neue', '思源黑体', sans-serif;\n      background: rgba(253, 249, 245, 0.9);\n      padding: 0.2rem 0.6rem;\n      border-radius: 12px 4px 12px 4px;\n      white-space: nowrap;}\n.contact-row{display: flex;\n      flex-wrap: wrap;\n      gap: 1.8rem;\n      margin-top: 0.5rem;\n      font-size: 0.9rem;\n      color: var(--text-secondary);\n      align-items: center;}\n.contact-item{display: flex;\n      align-items: center;\n      gap: 0.3rem;}\n.contact-icon{font-size: 1rem;\n      display: inline;\n      margin-right: 0.15rem;\n      color: var(--accent-soft-terracotta);\n      font-weight: 400;}\n.section-title{font-size: 1.1rem;\n      font-weight: 500;\n      text-transform: uppercase;\n      letter-spacing: 0.08em;\n      color: #3D3D3B;\n      margin: 1.8rem 0 0.9rem 0;\n      border-bottom: 1px solid var(--line-light);\n      padding-bottom: 0.25rem;\n      display: flex;\n      align-items: center;\n      font-family: 'Helvetica Neue', 'Arial', '思源黑体', sans-serif;}\n.section-title::after{content: \"\";\n      display: inline-block;\n      width: 28px;\n      height: 1px;\n      background: var(--accent-burnt-orange);\n      margin-left: 0.7rem;\n      opacity: 0.7;\n      transform: translateY(-1px);}\n.entry{margin-bottom: 1.2rem;}\n.entry-header{display: flex;\n      justify-content: space-between;\n      align-items: baseline;\n      flex-wrap: wrap;\n      margin-bottom: 0.2rem;}\n.institution{font-weight: 600;\n      font-size: 1rem;\n      color: #22211F;\n      letter-spacing: 0.01em;}\n.job-title{font-weight: 500;\n      font-size: 0.95rem;\n      color: var(--text-secondary);\n      margin-left: 0.3rem;}\n.date-location{font-size: 0.85rem;\n      color: var(--text-muted);\n      white-space: nowrap;\n      font-weight: 400;}\n.description{margin-top: 0.3rem;\n      padding-left: 0.2rem;}\n.desc-item{font-size: 0.9rem;\n      color: #3E3E3C;\n      margin-bottom: 0.25rem;\n      display: flex;\n      align-items: flex-start;\n      gap: 0.5rem;}\n.desc-item::before{content: \"•\";\n      color: var(--accent-burnt-orange);\n      font-weight: 500;\n      font-size: 1.1rem;\n      display: inline-block;\n      width: 0.9rem;\n      flex-shrink: 0;}\n.skill-tags{display: flex;\n      flex-wrap: wrap;\n      gap: 0.5rem 0.8rem;\n      margin-top: 0.3rem;}\n.skill{background: var(--surface-warm);\n      border: 1px solid #E8DDD2;\n      border-radius: 20px 4px 20px 4px;\n      padding: 0.25rem 1rem;\n      font-size: 0.85rem;\n      color: #3D3833;\n      letter-spacing: 0.02em;\n      white-space: nowrap;}\n.two-columns{display: grid;\n      grid-template-columns: 1fr 1fr;\n      gap: 1.2rem 1.8rem;\n      margin-top: 0.2rem;}\n.column-item{font-size: 0.9rem;\n      display: flex;\n      align-items: baseline;\n      gap: 0.4rem;\n      color: #3E3E3C;}\n.column-item strong{font-weight: 550;\n      color: #2B2A28;\n      min-width: 4.2rem;}\n.link-text{color: var(--text-secondary);\n      text-decoration: none;\n      border-bottom: 1px dotted var(--accent-burnt-orange);\n      font-weight: 400;}\n\n.resume{width:210mm;min-height:297mm;background:#FFFFFF;margin:0 auto;box-shadow:0 12px 30px rgba(0,0,0,0.08);font-family:Arial,\"Helvetica Neue\",\"思源黑体\",\"Source Han Sans SC\",sans-serif;color:#2E2E2C;line-height:1.5;position:relative;border-radius:4px;overflow:hidden}.summary{font-size:0.92rem;color:#3E3E3C;line-height:1.6;max-width:95%;margin-bottom:0.5rem}.skill-value{margin-left:6px}.pub-item{display:flex;flex-wrap:wrap;gap:1.2rem;align-items:baseline;font-size:0.9rem;margin-bottom:6px}.pub-name{font-weight:600}.pub-role{color:#5F5F5D}.award-line{display:flex;gap:1.5rem;margin-top:0.8rem;color:#5D5B58;font-size:0.85rem}.footer-note{margin-top:1.5rem;border-top:1px dashed #D9D2C7;padding-top:0.8rem;font-size:0.85rem;color:#5F5F5D;display:flex;justify-content:space-between}"}