{"code":"p05","name":"几何装饰品牌视觉","description":"陶土橙几何装饰+大字号深色姓名，适合品牌与视觉设计岗。","schema":{"type":"object","required":["name"],"properties":{"name":{"type":"string"},"title":{"type":"string"},"phone":{"type":"string"},"email":{"type":"string"},"location":{"type":"string"},"linkedin":{"type":"string"},"website":{"type":"string"},"summary":{"type":"string"},"experiences":{"type":"array","items":{"type":"object","properties":{"company":{"type":"string"},"role":{"type":"string"},"date":{"type":"string"},"location":{"type":"string"},"bullets":{"type":"array","items":{"type":"string"}}}}},"education":{"type":"array","items":{"type":"object","properties":{"school":{"type":"string"},"degree":{"type":"string"},"date":{"type":"string"},"location":{"type":"string"}}}},"skills":{"type":"array","items":{"type":"object","properties":{"category":{"type":"string"},"items":{"type":"array","items":{"type":"string"}}}}},"projects":{"type":"array","items":{"type":"object","properties":{"projectName":{"type":"string"},"projectRole":{"type":"string"},"projectDate":{"type":"string"},"stack":{"type":"string"},"bullets":{"type":"array","items":{"type":"string"}}}}},"certifications":{"type":"array","items":{"type":"object","properties":{"certName":{"type":"string"},"certDate":{"type":"string"}}}},"languages":{"type":"array","items":{"type":"string"}},"awards":{"type":"array","items":{"type":"object","properties":{"awardName":{"type":"string"},"awardDate":{"type":"string"}}}},"tags":{"type":"array","items":{"type":"string"}},"interests":{"type":"string"}}},"html":"<div class=\"resume\">\n  <div class=\"geometric-decor\"></div>\n  <div class=\"geometric-line\"></div>\n  <div class=\"accent-block\"></div>\n  <div class=\"resume-content\">\n    \n    <div class=\"header\">\n      <h1 class=\"name\">{{name}}</h1>\n      <div class=\"title\">{{title}}</div>\n      <div class=\"contact-row\">\n        <span class=\"contact-item\"><span class=\"icon\">✆</span>{{phone}}</span>\n        <span class=\"contact-item\"><span class=\"icon\">✉</span>{{email}}</span>\n        <span class=\"contact-item\"><span class=\"icon\">⌂</span>{{location}}</span>\n        <span class=\"contact-item\"><span class=\"icon\">🖵</span>{{website}}</span>\n      </div>\n    </div>\n    <div><div class=\"section-title\">专业概述</div><p class=\"summary\">{{summary}}</p></div>\n    <div>\n      <div class=\"section-title\">工作经历</div>\n      {{#each experiences}}<div class=\"experience-item\">\n        <div class=\"exp-header\"><span><span class=\"company\">{{company}}</span> <span class=\"role\">{{role}}</span></span><span class=\"date\">{{date}}</span></div>\n        <ul class=\"description\">{{#each bullets}}<li>{{.}}</li>{{/each}}</ul>\n      </div>{{/each}}\n    </div>\n    <div>\n      <div class=\"section-title\">核心能力</div>\n      <div class=\"skills-container\">{{#each skills}}<div class=\"skill-group\"><span class=\"skill-label\">{{category}}</span><div class=\"skill-tags\">{{#each items}}<span class=\"tag\">{{.}}</span>{{/each}}</div></div>{{/each}}</div>\n    </div>\n    <div>\n      <div class=\"section-title\">教育</div>\n      {{#each education}}<div class=\"education-item\"><span><span class=\"school\">{{school}}</span><span class=\"degree\">{{degree}}</span></span><span class=\"date\">{{date}}</span></div>{{/each}}\n    </div>\n    <div class=\"misc-line\">\n      <div><span class=\"misc-label\">语言</span><span>{{#each languages}}<span class=\"lang\">{{.}}</span>{{/each}}</span></div>\n      <div><span class=\"misc-label\">兴趣</span><span>{{interests}}</span></div>\n    </div>\n  </div>\n</div>","css":".resume{--page-width: 210mm;\n      --page-height: 297mm;\n      --primary: #1A3B47;      \n      --accent: #D94F2B;      \n      --body-text: #2E2E2C;\n      --muted: #5C5C5A;\n      --bg-light: #F9F7F4;\n      --divider: #D2CFC7;\n      --safe-white: #FFFFFF;\n      --geometric-light: #F0E9DF;}\n.resume{width: var(--page-width);\n      min-height: var(--page-height);\n      background: var(--safe-white);\n      box-shadow: 0 12px 28px rgba(0,0,0,0.15);\n      display: flex;\n      flex-direction: column;\n      position: relative;\n      overflow: hidden;\n      border-radius: 2px;\n      margin-bottom: 2rem;}\n.geometric-decor{position: absolute;\n      top: 0;\n      right: 0;\n      width: 280px;\n      height: 280px;\n      background: radial-gradient(circle at 100% 0%, rgba(217,79,43,0.18) 0%, rgba(26,59,71,0.06) 70%);\n      clip-path: polygon(100% 0, 0% 0, 100% 100%);\n      z-index: 0;\n      pointer-events: none;}\n.geometric-line{position: absolute;\n      top: 0;\n      left: 0;\n      width: 100%;\n      height: 100%;\n      background: repeating-linear-gradient(45deg, transparent, transparent 18px, rgba(217,79,43,0.05) 18px, rgba(217,79,43,0.05) 20px);\n      z-index: 0;\n      pointer-events: none;}\n.accent-block{position: absolute;\n      bottom: 0;\n      left: 0;\n      width: 180px;\n      height: 12px;\n      background: var(--accent);\n      z-index: 0;}\n.resume-content{position: relative;\n      z-index: 2;\n      padding: 1.6cm 2cm 1.4cm 2cm;\n      display: flex;\n      flex-direction: column;\n      gap: 1.2rem;\n      background: transparent;}\n.resume h1, .resume h2, .resume h3, .resume p, .resume li, .resume div, .resume span{font-weight: normal;}\n.header{display: flex;\n      flex-direction: column;\n      border-bottom: 3px solid var(--primary);\n      padding-bottom: 1rem;\n      margin-bottom: 0.5rem;}\n.name{font-size: 44pt;\n      font-family: 'Arial', 'Helvetica Neue', '思源黑体', sans-serif;\n      font-weight: 700;\n      color: var(--primary);\n      letter-spacing: 1px;\n      line-height: 1.1;\n      margin-bottom: 0.2rem;}\n.title{font-size: 14pt;\n      font-weight: 400;\n      color: var(--accent);\n      letter-spacing: 2px;\n      text-transform: uppercase;\n      font-family: 'Arial', 'Helvetica Neue', sans-serif;\n      margin-top: 0.1rem;}\n.contact-row{display: flex;\n      flex-wrap: wrap;\n      gap: 1.8rem;\n      margin-top: 1rem;\n      font-size: 10.5pt;\n      color: var(--muted);\n      align-items: center;}\n.contact-item{display: flex;\n      align-items: center;\n      gap: 0.3rem;}\n.icon{display: inline-block;\n      width: 16px;\n      text-align: center;\n      font-weight: 500;\n      color: var(--primary);}\n.section-title{font-size: 13pt;\n      font-weight: 700;\n      color: var(--primary);\n      text-transform: uppercase;\n      letter-spacing: 1.5px;\n      border-bottom: 1.8px solid var(--divider);\n      padding-bottom: 0.3rem;\n      margin-bottom: 0.8rem;\n      margin-top: 0.3rem;\n      font-family: 'Arial', 'Helvetica Neue', sans-serif;}\n.experience-item{margin-bottom: 1.1rem;}\n.exp-header{display: flex;\n      justify-content: space-between;\n      align-items: baseline;\n      flex-wrap: wrap;\n      margin-bottom: 0.25rem;}\n.company{font-weight: 700;\n      font-size: 12pt;\n      color: var(--body-text);}\n.role{font-weight: 600;\n      font-size: 11pt;\n      color: var(--primary);\n      margin-left: 0.5rem;\n      font-style: normal;}\n.date{font-size: 10pt;\n      color: var(--muted);\n      font-weight: 400;\n      white-space: nowrap;}\n.description{margin-top: 0.25rem;\n      padding-left: 1.2rem;\n      list-style-type: none;}\n.description li{font-size: 10pt;\n      color: var(--body-text);\n      margin-bottom: 0.3rem;\n      position: relative;\n      padding-left: 0.8rem;}\n.description li::before{content: \"•\";\n      position: absolute;\n      left: 0;\n      color: var(--accent);\n      font-weight: bold;\n      font-size: 10pt;}\n.skills-container{display: flex;\n      flex-wrap: wrap;\n      gap: 0.8rem 1.5rem;\n      margin-top: 0.3rem;}\n.skill-group{display: flex;\n      flex-wrap: wrap;\n      align-items: baseline;\n      gap: 0.5rem;}\n.skill-label{font-weight: 700;\n      font-size: 10.5pt;\n      color: var(--primary);}\n.skill-tags{display: flex;\n      flex-wrap: wrap;\n      gap: 0.5rem;}\n.tag{font-size: 10pt;\n      background: transparent;\n      color: var(--body-text);\n      border: 1px solid var(--divider);\n      padding: 0.2rem 0.8rem;\n      border-radius: 2px;\n      font-weight: 400;\n      background: var(--bg-light);}\n.education-item{display: flex;\n      justify-content: space-between;\n      align-items: baseline;\n      margin-bottom: 0.4rem;}\n.school{font-weight: 700;\n      font-size: 11pt;}\n.degree{font-weight: 400;\n      color: var(--muted);\n      margin-left: 0.5rem;}\n.resume hr{border: none;\n      border-top: 1px solid var(--divider);\n      margin: 0.5rem 0 0.8rem 0;}.summary{font-size:10.5pt;color:var(--body-text);line-height:1.6}.misc-line{display:flex;gap:3rem;margin-top:0.2rem}.misc-line .misc-label{font-weight:700;font-size:10.5pt;color:var(--primary);margin-right:0.8rem}.lang{margin-right:8px}"}