{"code":"p09","name":"代码风后端开发","description":"等宽字体代码标签+Markdown 风格分隔线，适合后端、基础设施与开发岗。","schema":{"type":"object","required":["name"],"properties":{"name":{"type":"string"},"title":{"type":"string"},"phone":{"type":"string"},"email":{"type":"string"},"location":{"type":"string"},"linkedin":{"type":"string"},"website":{"type":"string"},"summary":{"type":"string"},"experiences":{"type":"array","items":{"type":"object","properties":{"company":{"type":"string"},"role":{"type":"string"},"date":{"type":"string"},"location":{"type":"string"},"bullets":{"type":"array","items":{"type":"string"}}}}},"education":{"type":"array","items":{"type":"object","properties":{"school":{"type":"string"},"degree":{"type":"string"},"date":{"type":"string"},"location":{"type":"string"}}}},"skills":{"type":"array","items":{"type":"object","properties":{"category":{"type":"string"},"items":{"type":"array","items":{"type":"string"}}}}},"projects":{"type":"array","items":{"type":"object","properties":{"projectName":{"type":"string"},"projectRole":{"type":"string"},"projectDate":{"type":"string"},"stack":{"type":"string"},"bullets":{"type":"array","items":{"type":"string"}}}}},"certifications":{"type":"array","items":{"type":"object","properties":{"certName":{"type":"string"},"certDate":{"type":"string"}}}},"languages":{"type":"array","items":{"type":"string"}},"awards":{"type":"array","items":{"type":"object","properties":{"awardName":{"type":"string"},"awardDate":{"type":"string"}}}},"tags":{"type":"array","items":{"type":"string"}},"interests":{"type":"string"}}},"html":"<div class=\"resume\">\n  \n  <div class=\"header\">\n    <h1 class=\"name\">{{name}}</h1>\n    <div class=\"title-tag\">{{title}}</div>\n    <div class=\"contact-row\">\n      <span class=\"contact-item\"><span class=\"contact-icon\">📧</span>{{email}}</span>\n      <span class=\"contact-item\"><span class=\"contact-icon\">📱</span>{{phone}}</span>\n      <span class=\"contact-item\"><span class=\"contact-icon\">🐙</span>{{website}}</span>\n      <span class=\"contact-item\"><span class=\"contact-icon\">📍</span>{{location}}</span>\n    </div>\n  </div>\n  <hr class=\"divider\">\n  <div class=\"section\">\n    <h2 class=\"section-title\">技术能力</h2>\n    <div class=\"two-col-list\">{{#each skills}}<div class=\"col\"><ul>{{#each items}}<li><span class=\"code-font\">{{.}}</span></li>{{/each}}</ul></div>{{/each}}</div>\n    <div class=\"skills-container\">{{#each tags}}<span class=\"skill-tag\">{{.}}</span>{{/each}}</div>\n  </div>\n  <hr class=\"divider\">\n  <div class=\"section\">\n    <h2 class=\"section-title\">工作经历</h2>\n    {{#each experiences}}<div class=\"item\">\n      <div class=\"item-header\"><div class=\"item-left\"><span class=\"company\">{{company}}</span><span class=\"role\"> · {{role}}</span></div><div class=\"item-right\">{{date}}</div></div>\n      <div class=\"item-sub\">{{location}}</div>\n      <ul class=\"desc-list\">{{#each bullets}}<li>{{.}}</li>{{/each}}</ul>\n    </div>{{/each}}\n  </div>\n  <hr class=\"divider\">\n  <div class=\"section\">\n    <h2 class=\"section-title\">项目</h2>\n    {{#each projects}}<div class=\"item\">\n      <div class=\"item-header\"><div class=\"item-left\"><span class=\"company\">{{projectName}}</span><span class=\"role\"> · {{projectRole}}</span></div><div class=\"item-right\">{{projectDate}}</div></div>\n      <ul class=\"desc-list\">{{#each bullets}}<li>{{.}}</li>{{/each}}</ul>\n    </div>{{/each}}\n  </div>\n  <hr class=\"divider\">\n  <div class=\"section\">\n    <h2 class=\"section-title\">教育背景</h2>\n    {{#each education}}<div class=\"edu-item\"><span class=\"edu-left\">{{school}} · {{degree}}</span><span class=\"edu-right\">{{date}}</span></div>{{/each}}\n  </div>\n  <hr class=\"divider\">\n  <div class=\"section\">\n    <h2 class=\"section-title\">语言与证书</h2>\n    <div class=\"misc-line\">{{#each languages}}<div class=\"misc-item\"><strong>语言</strong> · {{.}}</div>{{/each}}{{#each certifications}}<div class=\"misc-item\"><strong>{{certName}}</strong> ({{certDate}})</div>{{/each}}</div>\n  </div>\n</div>","css":".resume{max-width: 800px;\n      width: 100%;\n      background: #ffffff;\n      box-shadow: 0 8px 24px rgba(0, 0, 0, 0.08);\n      border-radius: 4px;\n      padding: 2.2rem 2.5rem;\n      color: #1e2b3c;\n      line-height: 1.5;\n      font-size: 10.5pt;\n      transition: all 0.2s;}\n.resume{font-family: 'Calibri', 'Arial', 'Helvetica Neue', 'Noto Sans SC', '思源黑体', sans-serif;}\n.resume h1, .resume h2, .resume h3, .resume p, .resume li, .resume div, .resume span{color: #1e2b3c;}\n.header{margin-bottom: 1.8rem;}\n.name{font-size: 28pt;\n      font-weight: 700;\n      letter-spacing: 1px;\n      color: #0b2b44;\n      line-height: 1.2;\n      margin-bottom: 0.2rem;\n      font-family: 'Calibri', 'Helvetica Neue', 'Noto Sans SC', '思源黑体', sans-serif;}\n.title-tag{font-size: 12pt;\n      font-weight: 400;\n      color: #2c3e50;\n      margin-bottom: 0.8rem;\n      display: flex;\n      align-items: center;\n      gap: 0.5rem;}\n.title-tag::after{content: \"\";\n      flex: 1;\n      height: 1px;\n      background: #cbd5e0;\n      margin-left: 0.75rem;}\n.contact-row{display: flex;\n      flex-wrap: wrap;\n      gap: 1.2rem;\n      font-size: 9.5pt;\n      color: #2d3a4a;\n      margin-top: 0.3rem;\n      font-family: 'Calibri', 'Arial', 'Helvetica Neue', 'Noto Sans SC', sans-serif;}\n.contact-item{display: flex;\n      align-items: center;\n      gap: 0.3rem;}\n.contact-icon{font-size: 10pt;\n      color: #2c5282;\n      font-weight: 500;}\n.divider{border: none;\n      border-top: 1.5px solid #dce3ea;\n      margin: 1.2rem 0 1.5rem 0;}\n.section-title{font-size: 10.5pt;\n      font-weight: 700;\n      text-transform: uppercase;\n      letter-spacing: 1.2px;\n      color: #0b2b44;\n      margin-bottom: 0.8rem;\n      display: flex;\n      align-items: center;\n      gap: 0.5rem;\n      font-family: 'Calibri', 'Helvetica Neue', 'Noto Sans SC', '思源黑体', sans-serif;}\n.section-title::after{content: \"\";\n      flex: 1;\n      height: 1px;\n      background: #cbd5e0;\n      margin-left: 0.5rem;}\n.item{margin-bottom: 1.1rem;}\n.item-header{display: flex;\n      justify-content: space-between;\n      align-items: baseline;\n      flex-wrap: wrap;\n      margin-bottom: 0.15rem;}\n.item-left{font-weight: 700;\n      font-size: 11pt;\n      color: #0b2b44;}\n.item-left .company{font-weight: 700;}\n.item-left .role{font-weight: 500;\n      color: #2c3e50;\n      margin-left: 0.3rem;\n      font-size: 10.5pt;}\n.item-right{font-weight: 400;\n      font-size: 9.5pt;\n      color: #4a5c6c;\n      white-space: nowrap;}\n.item-sub{font-weight: 400;\n      color: #3c4f62;\n      font-size: 10pt;\n      margin-bottom: 0.3rem;}\n.desc-list{list-style: none;\n      padding-left: 0;\n      margin-top: 0.3rem;}\n.desc-list li{position: relative;\n      padding-left: 1.1rem;\n      margin-bottom: 0.25rem;\n      font-size: 10pt;\n      color: #2d3a4a;\n      line-height: 1.5;}\n.desc-list li::before{content: \"•\";\n      position: absolute;\n      left: 0.1rem;\n      color: #2c5282;\n      font-weight: 600;}\n.skills-container{display: flex;\n      flex-wrap: wrap;\n      gap: 0.6rem 1rem;\n      margin-top: 0.4rem;}\n.skill-tag{font-family: 'Cascadia Code', 'Fira Code', 'Consolas', 'Monaco', 'Courier New', monospace;\n      background: #f0f4f8;\n      padding: 0.15rem 0.7rem;\n      border-radius: 3px;\n      font-size: 9.5pt;\n      color: #1e2b3c;\n      letter-spacing: 0.2px;\n      border: 1px solid #e2e8f0;}\n.code-font{font-family: 'Cascadia Code', 'Fira Code', 'Consolas', 'Monaco', 'Courier New', monospace;\n      background: #f7f9fc;\n      padding: 0.1rem 0.3rem;\n      border-radius: 2px;\n      font-size: 9.5pt;\n      color: #0b2b44;}\n.inline-code{font-family: 'Cascadia Code', 'Fira Code', 'Consolas', 'Monaco', monospace;\n      font-size: 9.5pt;\n      color: #2c5282;\n      background: #f0f4f8;\n      padding: 0 0.2rem;}\n.two-col-list{display: flex;\n      flex-wrap: wrap;\n      gap: 1.5rem;}\n.col{flex: 1 1 200px;}\n.col ul{list-style: none;\n      padding-left: 0;}\n.col li{margin-bottom: 0.25rem;\n      font-size: 10pt;\n      display: flex;\n      align-items: baseline;}\n.col li::before{content: \"•\";\n      color: #2c5282;\n      font-weight: 600;\n      margin-right: 0.5rem;}\n.edu-item{display: flex;\n      justify-content: space-between;\n      margin-bottom: 0.3rem;\n      font-size: 10pt;}\n.edu-left{font-weight: 700;\n      color: #0b2b44;}\n.edu-right{color: #4a5c6c;\n      font-size: 9.5pt;}.misc-line{display:flex;flex-wrap:wrap;gap:2rem;font-size:10pt}.misc-item{color:#2d3a4a}.misc-item strong{color:#0b2b44}"}