{"code":"p10","name":"终端暗色前端","description":"命令行暗色主题，绿色提示符与等宽字体，适合前端与极客风格。","schema":{"type":"object","required":["name"],"properties":{"name":{"type":"string"},"title":{"type":"string"},"phone":{"type":"string"},"email":{"type":"string"},"location":{"type":"string"},"linkedin":{"type":"string"},"website":{"type":"string"},"summary":{"type":"string"},"experiences":{"type":"array","items":{"type":"object","properties":{"company":{"type":"string"},"role":{"type":"string"},"date":{"type":"string"},"location":{"type":"string"},"bullets":{"type":"array","items":{"type":"string"}}}}},"education":{"type":"array","items":{"type":"object","properties":{"school":{"type":"string"},"degree":{"type":"string"},"date":{"type":"string"},"location":{"type":"string"}}}},"skills":{"type":"array","items":{"type":"object","properties":{"category":{"type":"string"},"items":{"type":"array","items":{"type":"string"}}}}},"projects":{"type":"array","items":{"type":"object","properties":{"projectName":{"type":"string"},"projectRole":{"type":"string"},"projectDate":{"type":"string"},"stack":{"type":"string"},"bullets":{"type":"array","items":{"type":"string"}}}}},"certifications":{"type":"array","items":{"type":"object","properties":{"certName":{"type":"string"},"certDate":{"type":"string"}}}},"languages":{"type":"array","items":{"type":"string"}},"awards":{"type":"array","items":{"type":"object","properties":{"awardName":{"type":"string"},"awardDate":{"type":"string"}}}},"tags":{"type":"array","items":{"type":"string"}},"interests":{"type":"string"}}},"html":"<div class=\"resume\">\n  \n  <h1><span class=\"cli-prefix\">$ </span>{{name}}</h1>\n  <div class=\"title-sub\"><span class=\"cli-prefix\">></span> {{title}}</div>\n  <div class=\"contact-row\">\n    <span class=\"contact-item\"><span class=\"icon-symbol\">📧</span>{{email}}</span>\n    <span class=\"contact-item\"><span class=\"icon-symbol\">📞</span>{{phone}}</span>\n    <span class=\"contact-item\"><span class=\"icon-symbol\">🐙</span>{{website}}</span>\n    <span class=\"contact-item\"><span class=\"icon-symbol\">📍</span>{{location}}</span>\n  </div>\n  <div class=\"section-title\">技能栈</div>\n  <div class=\"two-col\">{{#each skills}}<div class=\"col\"><div class=\"skill-tags\"><span class=\"tag\"><strong>{{category}}</strong> {{#each items}}{{.}} {{/each}}</span></div></div>{{/each}}</div>\n  <div class=\"tool-line\"><span class=\"cli-prefix\">#</span> 工具链: {{#each tags}}<span class=\"tool-item\">{{.}}</span>{{/each}}</div>\n  <div class=\"section-title\">工作经验</div>\n  {{#each experiences}}<div class=\"exp-item\">\n    <div class=\"exp-header\"><span><span class=\"company\">{{company}}</span><span class=\"role\"> — {{role}}</span></span><span class=\"date\">{{date}}</span></div>\n    <ul class=\"desc-list\">{{#each bullets}}<li>{{.}}</li>{{/each}}</ul>\n  </div>{{/each}}\n  <div class=\"section-title\">精选项目</div>\n  {{#each projects}}<div class=\"exp-item\">\n    <div class=\"exp-header\"><span><span class=\"company\">{{projectName}}</span><span class=\"role\"> — {{projectRole}}</span></span><span class=\"date\">{{projectDate}}</span></div>\n    <ul class=\"desc-list\">{{#each bullets}}<li>{{.}}</li>{{/each}}</ul>\n  </div>{{/each}}\n  <div class=\"section-title\">教育</div>\n  {{#each education}}<div class=\"edu-item\"><span><span class=\"school-name\">{{school}}</span><span class=\"degree\"> · {{degree}}</span></span><span class=\"date\">{{date}}</span></div>{{/each}}\n  <div class=\"section-title\">语言与证书</div>\n  <div class=\"cert-line\">{{#each languages}}<span class=\"cert-item\"><span class=\"cert-icon\">❯</span>{{.}}</span>{{/each}}{{#each certifications}}<span class=\"cert-item\"><span class=\"cert-icon\">❯</span>{{certName}}</span>{{/each}}</div>\n</div>","css":".resume{--bg: #0a0c0f;\n      --surface: #13171c;\n      --border: #2a3038;\n      --text-primary: #e1e4e8;\n      --text-secondary: #b0b8c1;\n      --text-muted: #6e7681;\n      --accent-green: #3fb950;\n      --accent-blue: #58a6ff;\n      --accent-orange: #d2991d;\n      --accent-red: #f85149;\n      --highlight-line: #1f6feb;\n      --code-bg: #161b22;\n      --font-mono: 'SF Mono', 'Cascadia Code', 'Consolas', 'Fira Code', 'Courier New', monospace;\n      --font-sans: -apple-system, BlinkMacSystemFont, 'Segoe UI', 'Helvetica Neue', Arial, '思源黑体', 'Noto Sans SC', sans-serif;}\n.resume{max-width: 210mm;\n      width: 100%;\n      background-color: var(--bg);\n      border: 1px solid var(--border);\n      box-shadow: 0 20px 40px rgba(0, 0, 0, 0.7);\n      padding: 0.75in 0.8in;\n      margin: 0 auto;\n      font-size: 10.5pt;\n      color: var(--text-primary);\n      position: relative;}\n.cli-prefix{color: var(--accent-green);\n      font-family: var(--font-mono);\n      font-weight: 400;\n      margin-right: 0.25rem;\n      user-select: none;}\n.resume h1, .resume h2, .resume h3, .resume p, .resume li, .resume span, .resume div{color: inherit;}\n.resume a{color: var(--accent-blue);\n      text-decoration: none;}\n.resume h1{font-size: 26pt;\n      font-weight: 600;\n      letter-spacing: 0.5px;\n      color: #ffffff;\n      margin-bottom: 0.1rem;\n      font-family: var(--font-mono);\n      border-bottom: 1px solid var(--border);\n      padding-bottom: 0.2rem;}\n.title-sub{font-size: 12pt;\n      color: var(--accent-blue);\n      font-family: var(--font-mono);\n      margin-bottom: 0.9rem;\n      font-weight: 400;}\n.section-title{font-size: 11pt;\n      font-weight: 600;\n      text-transform: uppercase;\n      letter-spacing: 1.2px;\n      color: var(--accent-green);\n      margin-top: 1.3rem;\n      margin-bottom: 0.6rem;\n      border-bottom: 1px solid var(--border);\n      padding-bottom: 0.15rem;\n      font-family: var(--font-mono);\n      display: flex;\n      align-items: center;\n      gap: 0.3rem;}\n.section-title::before{content: \"❯\";\n      color: var(--accent-green);\n      font-weight: 400;\n      font-size: 10pt;}\n.exp-item{margin-bottom: 0.7rem;}\n.exp-header{display: flex;\n      justify-content: space-between;\n      align-items: baseline;\n      flex-wrap: wrap;\n      margin-bottom: 0.15rem;}\n.company{font-weight: 700;\n      font-size: 11pt;\n      color: #ffffff;\n      font-family: var(--font-sans);}\n.role{font-weight: 500;\n      color: var(--text-secondary);\n      margin-left: 0.3rem;\n      font-size: 10.5pt;}\n.date{font-family: var(--font-mono);\n      color: var(--text-muted);\n      font-size: 9.5pt;\n      white-space: nowrap;}\n.desc-list{list-style: none;\n      padding-left: 0;\n      margin-top: 0.2rem;\n      color: var(--text-secondary);}\n.desc-list li{position: relative;\n      padding-left: 1.2rem;\n      margin-bottom: 0.2rem;\n      font-size: 10pt;}\n.desc-list li::before{content: \"•\";\n      position: absolute;\n      left: 0.2rem;\n      color: var(--accent-orange);\n      font-weight: bold;\n      font-family: monospace;}\n.skill-tags{display: flex;\n      flex-wrap: wrap;\n      gap: 0.4rem;\n      margin-top: 0.2rem;}\n.tag{background-color: var(--surface);\n      border: 1px solid var(--border);\n      color: var(--text-primary);\n      padding: 0.2rem 0.7rem;\n      border-radius: 4px;\n      font-size: 9.5pt;\n      font-family: var(--font-mono);\n      white-space: nowrap;}\n.tag strong{color: var(--accent-blue);\n      font-weight: 500;\n      margin-right: 0.2rem;}\n.contact-row{display: flex;\n      flex-wrap: wrap;\n      gap: 1.5rem;\n      margin: 0.5rem 0 0.2rem;\n      font-family: var(--font-mono);\n      font-size: 9.5pt;\n      color: var(--text-secondary);\n      border-bottom: 1px dashed var(--border);\n      padding-bottom: 0.5rem;}\n.contact-item{display: flex;\n      align-items: center;\n      gap: 0.3rem;}\n.icon-symbol{color: var(--accent-green);\n      font-weight: 400;}\n.two-col{display: grid;\n      grid-template-columns: 1fr 1fr;\n      gap: 1rem;\n      margin-top: 0.3rem;}\n.col{display: flex;\n      flex-direction: column;}\n.resume hr{border: none;\n      border-top: 1px solid var(--border);\n      margin: 0.5rem 0 0.2rem;}\n.edu-item{display: flex;\n      justify-content: space-between;\n      margin-bottom: 0.25rem;\n      font-size: 10pt;}\n.school-name{font-weight: 600;\n      color: #ffffff;}\n.degree{color: var(--text-secondary);\n      margin-left: 0.4rem;}\n\n.resume{font-family:var(--font-sans)}.tool-line{display:flex;flex-wrap:wrap;gap:8px;margin-top:0.5rem;font-size:9.5pt;color:var(--text-muted)}.tool-item{margin-right:4px}.cert-line{display:flex;flex-wrap:wrap;gap:1.5rem;font-size:10pt}.cert-item{display:inline-flex;gap:4px}.cert-icon{color:var(--accent-green)}"}