{"code":"p12","name":"技术文档 DevOps","description":"深蓝灰技术文档风+圆角技能标签，适合 DevOps、SRE 与云原生岗。","schema":{"type":"object","required":["name"],"properties":{"name":{"type":"string"},"title":{"type":"string"},"phone":{"type":"string"},"email":{"type":"string"},"location":{"type":"string"},"linkedin":{"type":"string"},"website":{"type":"string"},"summary":{"type":"string"},"experiences":{"type":"array","items":{"type":"object","properties":{"company":{"type":"string"},"role":{"type":"string"},"date":{"type":"string"},"location":{"type":"string"},"bullets":{"type":"array","items":{"type":"string"}}}}},"education":{"type":"array","items":{"type":"object","properties":{"school":{"type":"string"},"degree":{"type":"string"},"date":{"type":"string"},"location":{"type":"string"}}}},"skills":{"type":"array","items":{"type":"object","properties":{"category":{"type":"string"},"items":{"type":"array","items":{"type":"string"}}}}},"projects":{"type":"array","items":{"type":"object","properties":{"projectName":{"type":"string"},"projectRole":{"type":"string"},"projectDate":{"type":"string"},"stack":{"type":"string"},"bullets":{"type":"array","items":{"type":"string"}}}}},"certifications":{"type":"array","items":{"type":"object","properties":{"certName":{"type":"string"},"certDate":{"type":"string"}}}},"languages":{"type":"array","items":{"type":"string"}},"awards":{"type":"array","items":{"type":"object","properties":{"awardName":{"type":"string"},"awardDate":{"type":"string"}}}},"tags":{"type":"array","items":{"type":"string"}},"interests":{"type":"string"}}},"html":"<div class=\"resume\">\n  \n  <div class=\"name-section\">\n    <h1 class=\"name\">{{name}}</h1>\n    <div class=\"title-tagline\"><span>⚙️ {{title}}</span></div>\n    <div class=\"contact-row\">\n      <span class=\"contact-item\">📧 {{email}}</span>\n      <span class=\"contact-item\">📱 {{phone}}</span>\n      <span class=\"contact-item\">🐙 {{website}}</span>\n      <span class=\"contact-item\">📍 {{location}}</span>\n    </div>\n  </div>\n  <div>\n    <div class=\"section-title\">专业概览</div>\n    <div class=\"left-accent-bar\"><p class=\"summary\">{{summary}}</p></div>\n  </div>\n  <div>\n    <div class=\"section-title\">核心技术栈</div>\n    {{#each skills}}<div class=\"skill-block\"><span class=\"skill-category\">{{category}}：</span>{{#each items}}<span class=\"skill-tag\">{{.}}</span>{{/each}}</div>{{/each}}\n  </div>\n  <div>\n    <div class=\"section-title\">专业经历</div>\n    {{#each experiences}}<div class=\"experience-item\">\n      <div class=\"exp-header\"><div><span class=\"company-name\">{{company}}</span><span class=\"job-title\">· {{role}}</span></div><div class=\"date-location\">{{date}} | {{location}}</div></div>\n      <ul class=\"description\">{{#each bullets}}<li>{{.}}</li>{{/each}}</ul>\n    </div>{{/each}}\n  </div>\n  <div>\n    <div class=\"section-title\">开源生态 &amp; 技术影响力</div>\n    {{#each projects}}<div class=\"project-item\"><span class=\"project-title\">{{projectName}}</span><span class=\"project-stack\">{{projectRole}}</span><div class=\"project-desc\">{{#each bullets}}<div>{{.}}</div>{{/each}}</div></div>{{/each}}\n  </div>\n  <div>\n    <div class=\"section-title\">教育背景</div>\n    {{#each education}}<div class=\"edu-row\"><span class=\"edu-school\">{{school}}</span><span class=\"edu-degree\">{{degree}}</span><span class=\"date-location\">{{date}}</span></div>{{/each}}\n  </div>\n  <div>\n    <div class=\"section-title\">认证 &amp; 语言</div>\n    <div class=\"cert-line\">{{#each certifications}}<span class=\"skill-tag\">{{certName}}</span>{{/each}}<span class=\"lang-line\">{{#each languages}}<span class=\"lang\">{{.}}</span>{{/each}}</span></div>\n  </div>\n</div>","css":".resume{--primary: #1e3a5f;    \n      --accent: #2c5f2d;     \n      --body-text: #1f2a3a;\n      --light-bg: #f8fafc;\n      --divider: #d1d9e0;\n      --tag-bg: #e9edf2;\n      --tag-text: #1e3a5f;\n      --white: #ffffff;\n      --print-black: #000000;}\n.resume{width: 100%;\n      padding: 0.7in 0.7in 0.6in 0.7in;\n      background: white;}\n.resume h1, .resume h2, .resume h3, .resume p, .resume li, .resume span, .resume div{font-weight: normal;}\n.name-section{margin-bottom: 28px;\n      border-bottom: 2px solid var(--primary);\n      padding-bottom: 16px;}\n.name{font-size: 2.4rem;\n      font-weight: 700;\n      letter-spacing: 0.5px;\n      color: var(--primary);\n      margin-bottom: 6px;\n      line-height: 1.2;\n      font-family: 'Arial', 'Helvetica Neue', 'Calibri', '思源黑体', sans-serif;}\n.title-tagline{font-size: 1.1rem;\n      font-weight: 400;\n      color: #2d3a4a;\n      display: flex;\n      flex-wrap: wrap;\n      gap: 18px;\n      margin-top: 4px;\n      align-items: center;}\n.title-tagline span{display: inline-flex;\n      align-items: center;\n      gap: 4px;}\n.contact-row{margin-top: 12px;\n      font-size: 0.9rem;\n      color: #334155;\n      display: flex;\n      flex-wrap: wrap;\n      gap: 18px;\n      align-items: center;}\n.contact-item{display: inline-flex;\n      align-items: center;\n      gap: 5px;}\n.section-title{font-size: 1rem;\n      font-weight: 700;\n      text-transform: uppercase;\n      letter-spacing: 1px;\n      color: var(--primary);\n      border-bottom: 1.5px solid var(--divider);\n      padding-bottom: 5px;\n      margin: 28px 0 14px 0;\n      font-family: 'Arial', 'Helvetica Neue', sans-serif;}\n.experience-item{margin-bottom: 20px;}\n.exp-header{display: flex;\n      justify-content: space-between;\n      align-items: baseline;\n      flex-wrap: wrap;\n      margin-bottom: 4px;}\n.company-name{font-weight: 700;\n      font-size: 1rem;\n      color: #0b1c2e;}\n.job-title{font-weight: 600;\n      color: #1f2a3a;\n      margin-left: 8px;\n      font-size: 0.95rem;}\n.date-location{font-size: 0.85rem;\n      color: #4b5563;\n      white-space: nowrap;\n      text-align: right;}\n.description{margin-top: 5px;\n      padding-left: 0;\n      list-style: none;}\n.description li{position: relative;\n      padding-left: 18px;\n      margin-bottom: 5px;\n      font-size: 0.9rem;\n      color: #1e293b;\n      line-height: 1.5;}\n.description li::before{content: \"•\";\n      position: absolute;\n      left: 2px;\n      color: #2c3e50;\n      font-weight: bold;}\n.skills-container{display: flex;\n      flex-wrap: wrap;\n      gap: 10px;\n      align-items: center;}\n.skill-tag{background: var(--tag-bg);\n      color: var(--tag-text);\n      padding: 5px 14px;\n      border-radius: 20px;\n      font-size: 0.85rem;\n      font-weight: 500;\n      letter-spacing: 0.2px;\n      border: 1px solid #ccd7e4;\n      white-space: nowrap;}\n.skill-category{font-weight: 700;\n      margin-right: 6px;\n      color: #0f263b;\n      font-size: 0.9rem;}\n.two-column-list{display: flex;\n      flex-wrap: wrap;\n      gap: 8px 30px;\n      list-style: none;\n      padding-left: 0;\n      margin-top: 5px;}\n.two-column-list li{width: calc(50% - 15px);\n      font-size: 0.9rem;\n      position: relative;\n      padding-left: 16px;}\n.two-column-list li::before{content: \"•\";\n      position: absolute;\n      left: 0;\n      color: #2c3e50;}\n.project-item{margin-bottom: 14px;}\n.project-title{font-weight: 700;\n      font-size: 0.95rem;\n      color: #0f2b44;}\n.project-stack{font-size: 0.8rem;\n      color: #4b5563;\n      margin-left: 10px;\n      font-weight: 400;}\n.left-accent-bar{border-left: 4px solid var(--primary);\n      padding-left: 18px;\n      margin-top: 4px;}\n.resume hr{border: none;\n      border-top: 1px solid var(--divider);\n      margin: 16px 0 10px 0;}\n\n.resume{max-width:210mm;margin:0 auto;box-shadow:0 8px 20px rgba(0,0,0,0.08);font-family:Arial,\"Helvetica Neue\",\"Calibri\",\"思源黑体\",\"Source Han Sans SC\",\"Noto Sans SC\",sans-serif;color:#1f2a3a;line-height:1.5}.summary{font-size:0.92rem;color:#1e293b}.skill-block{margin-bottom:10px}.skill-block .skill-category{display:inline-block;margin-bottom:4px}.project-desc{margin-top:3px;font-size:0.88rem;color:#2d3a4a}.edu-row{display:flex;justify-content:space-between;align-items:baseline;flex-wrap:wrap}.cert-line{display:flex;flex-wrap:wrap;gap:14px;align-items:center}.lang-line{margin-left:auto;font-size:0.9rem}.lang{margin-right:8px}"}