{"code":"p08","name":"黑白杂志时尚买手","description":"高对比黑白杂志风，大写字名与黑框标签，适合时尚、买手与品牌商品岗。","schema":{"type":"object","required":["name"],"properties":{"name":{"type":"string"},"title":{"type":"string"},"phone":{"type":"string"},"email":{"type":"string"},"location":{"type":"string"},"linkedin":{"type":"string"},"website":{"type":"string"},"summary":{"type":"string"},"experiences":{"type":"array","items":{"type":"object","properties":{"company":{"type":"string"},"role":{"type":"string"},"date":{"type":"string"},"location":{"type":"string"},"bullets":{"type":"array","items":{"type":"string"}}}}},"education":{"type":"array","items":{"type":"object","properties":{"school":{"type":"string"},"degree":{"type":"string"},"date":{"type":"string"},"location":{"type":"string"}}}},"skills":{"type":"array","items":{"type":"object","properties":{"category":{"type":"string"},"items":{"type":"array","items":{"type":"string"}}}}},"projects":{"type":"array","items":{"type":"object","properties":{"projectName":{"type":"string"},"projectRole":{"type":"string"},"projectDate":{"type":"string"},"stack":{"type":"string"},"bullets":{"type":"array","items":{"type":"string"}}}}},"certifications":{"type":"array","items":{"type":"object","properties":{"certName":{"type":"string"},"certDate":{"type":"string"}}}},"languages":{"type":"array","items":{"type":"string"}},"awards":{"type":"array","items":{"type":"object","properties":{"awardName":{"type":"string"},"awardDate":{"type":"string"}}}},"tags":{"type":"array","items":{"type":"string"}},"interests":{"type":"string"}}},"html":"<div class=\"resume\">\n  <div class=\"resume-inner\">\n    \n    <div class=\"name-section\">\n      <h1 class=\"name\">{{name}}</h1>\n      <div class=\"title-tagline\"><span class=\"title-role\">{{title}}</span><span class=\"title-location\">{{location}}</span></div>\n      <div class=\"contact-row\">\n        <span class=\"contact-item\"><span class=\"contact-icon\">✆</span>{{phone}}</span>\n        <span class=\"contact-item\"><span class=\"contact-icon\">✉</span>{{email}}</span>\n        <span class=\"contact-item\"><span class=\"contact-icon\">⛓</span>{{linkedin}}</span>\n        <span class=\"contact-item\"><span class=\"contact-icon\">◈</span>{{website}}</span>\n      </div>\n    </div>\n    <div class=\"section\"><div class=\"section-title\">专业轮廓</div><p class=\"summary\">{{summary}}</p></div>\n    <div class=\"section\"><div class=\"section-title\">核心能力</div><div class=\"skills-container\">{{#each tags}}<span class=\"skill-tag\">{{.}}</span>{{/each}}</div></div>\n    <div class=\"section\">\n      <div class=\"section-title\">职业经历</div>\n      {{#each experiences}}<div class=\"experience-item\">\n        <div class=\"exp-header\"><div><span class=\"company-name\">{{company}}</span><span class=\"job-title\"> | {{role}}</span></div><div class=\"date-right\">{{date}}</div></div>\n        <ul class=\"exp-details\">{{#each bullets}}<li>{{.}}</li>{{/each}}</ul>\n      </div>{{/each}}\n    </div>\n    <div class=\"section\">\n      <div class=\"section-title\">教育</div>\n      {{#each education}}<div class=\"edu-item\"><span class=\"edu-degree\">{{degree}}</span><span class=\"edu-school\">{{school}}</span><span class=\"edu-date\">{{date}}</span></div>{{/each}}\n    </div>\n    <div class=\"section\">\n      <div class=\"section-title\">语言 · 证书</div>\n      <div class=\"misc-row\">{{#each languages}}<div class=\"misc-block\">{{.}}</div>{{/each}}</div>\n      <div class=\"misc-row\"><div class=\"misc-block\"><span class=\"misc-label\">认证</span>{{#each certifications}}{{certName}}{{/each}}</div></div>\n    </div>\n    <div class=\"section\">\n      <div class=\"section-title\">关键项目</div>\n      {{#each projects}}<div class=\"experience-item\">\n        <div class=\"exp-header\"><span class=\"company-name\">{{projectName}}</span><span class=\"date-right\">{{projectDate}}</span></div>\n        <ul class=\"exp-details\">{{#each bullets}}<li>{{.}}</li>{{/each}}</ul>\n      </div>{{/each}}\n    </div>\n  </div>\n</div>","css":".resume{max-width: 210mm;\n      width: 100%;\n      background: #ffffff;\n      color: #1a1a1a;\n      box-shadow: 0 12px 30px rgba(0,0,0,0.15);\n      border: 1px solid #e0e0e0;\n      margin: 0 auto;\n      font-size: 14px;\n      line-height: 1.5;\n      padding: 0;}\n.resume-inner{padding: 0.7in 0.7in 0.7in 0.7in;}\n.resume h1, .resume h2, .resume h3, .resume p, .resume div, .resume span, .resume li{font-weight: normal;\n      color: #1a1a1a;}\n.name-section{margin-bottom: 0.25in;}\n.name{font-size: 38pt;\n      font-weight: 700;\n      letter-spacing: 1.5px;\n      text-transform: uppercase;\n      color: #0a0a0a;\n      line-height: 1.1;\n      margin-bottom: 8px;\n      font-family: 'Helvetica Neue', 'Arial', '思源黑体', sans-serif;}\n.title-tagline{font-size: 14pt;\n      font-weight: 400;\n      letter-spacing: 2px;\n      text-transform: uppercase;\n      color: #2c2c2c;\n      margin-bottom: 16px;\n      border-bottom: 2.5px solid #0a0a0a;\n      padding-bottom: 14px;\n      display: flex;\n      justify-content: space-between;\n      align-items: flex-end;}\n.title-role{font-weight: 600;\n      color: #000;}\n.title-location{font-size: 10pt;\n      letter-spacing: 1px;\n      color: #3d3d3d;\n      font-weight: 400;}\n.contact-row{display: flex;\n      flex-wrap: wrap;\n      gap: 18px;\n      margin-top: 6px;\n      font-size: 10.5pt;\n      color: #2c2c2c;\n      font-weight: 400;\n      letter-spacing: 0.3px;}\n.contact-item{display: inline-flex;\n      align-items: center;\n      gap: 4px;}\n.contact-icon{font-weight: 600;\n      color: #000;\n      font-size: 11pt;}\n.section{margin-top: 0.3in;}\n.section-title{font-size: 13pt;\n      font-weight: 700;\n      letter-spacing: 1.8px;\n      text-transform: uppercase;\n      color: #0a0a0a;\n      border-bottom: 1.5px solid #b3b3b3;\n      padding-bottom: 5px;\n      margin-bottom: 14px;\n      font-family: 'Helvetica Neue', 'Arial', '思源黑体', sans-serif;}\n.experience-item{margin-bottom: 0.2in;}\n.exp-header{display: flex;\n      justify-content: space-between;\n      align-items: baseline;\n      flex-wrap: wrap;}\n.company-name{font-weight: 700;\n      font-size: 15pt;\n      color: #0a0a0a;\n      letter-spacing: 0.4px;}\n.job-title{font-weight: 500;\n      font-size: 12pt;\n      color: #2c2c2c;\n      margin-left: 6px;\n      font-style: normal;}\n.date-right{font-weight: 400;\n      font-size: 10.5pt;\n      color: #4a4a4a;\n      letter-spacing: 0.5px;\n      white-space: nowrap;}\n.exp-details{margin-top: 8px;\n      padding-left: 0;\n      list-style: none;}\n.exp-details li{font-size: 11pt;\n      line-height: 1.55;\n      margin-bottom: 6px;\n      color: #2a2a2a;\n      position: relative;\n      padding-left: 16px;}\n.exp-details li::before{content: \"•\";\n      position: absolute;\n      left: 0;\n      font-weight: 600;\n      color: #0a0a0a;}\n.skills-container{display: flex;\n      flex-wrap: wrap;\n      gap: 10px;\n      margin-top: 6px;}\n.skill-tag{font-size: 10.5pt;\n      font-weight: 500;\n      color: #1a1a1a;\n      background: transparent;\n      border: 1.2px solid #2c2c2c;\n      padding: 5px 14px;\n      letter-spacing: 0.4px;\n      text-transform: uppercase;}\n.edu-item{display: flex;\n      justify-content: space-between;\n      margin-bottom: 6px;\n      font-size: 11pt;}\n.edu-degree{font-weight: 700;\n      color: #0a0a0a;}\n.edu-school{font-weight: 400;\n      color: #2c2c2c;}\n.edu-date{font-weight: 400;\n      color: #4a4a4a;\n      white-space: nowrap;}\n.misc-row{display: flex;\n      flex-wrap: wrap;\n      gap: 30px;\n      margin-top: 8px;}\n.misc-block{font-size: 11pt;}\n.misc-label{font-weight: 700;\n      color: #0a0a0a;\n      margin-right: 6px;}\n.resume hr{border: none;\n      border-top: 1px solid #c0c0c0;\n      margin: 16px 0 10px;}.summary{font-size:11.5pt;line-height:1.6;color:#2a2a2a;margin-bottom:4px}.misc-row .misc-block{margin-bottom:4px}"}