{"code":"p03","name":"深墨绿战略咨询","description":"深墨绿+古铜金商务风，左侧装饰条与分段细线，适合战略、咨询与管理岗。","schema":{"type":"object","required":["name"],"properties":{"name":{"type":"string"},"title":{"type":"string"},"phone":{"type":"string"},"email":{"type":"string"},"location":{"type":"string"},"linkedin":{"type":"string"},"website":{"type":"string"},"summary":{"type":"string"},"experiences":{"type":"array","items":{"type":"object","properties":{"company":{"type":"string"},"role":{"type":"string"},"date":{"type":"string"},"location":{"type":"string"},"bullets":{"type":"array","items":{"type":"string"}}}}},"education":{"type":"array","items":{"type":"object","properties":{"school":{"type":"string"},"degree":{"type":"string"},"date":{"type":"string"},"location":{"type":"string"}}}},"skills":{"type":"array","items":{"type":"object","properties":{"category":{"type":"string"},"items":{"type":"array","items":{"type":"string"}}}}},"projects":{"type":"array","items":{"type":"object","properties":{"projectName":{"type":"string"},"projectRole":{"type":"string"},"projectDate":{"type":"string"},"stack":{"type":"string"},"bullets":{"type":"array","items":{"type":"string"}}}}},"certifications":{"type":"array","items":{"type":"object","properties":{"certName":{"type":"string"},"certDate":{"type":"string"}}}},"languages":{"type":"array","items":{"type":"string"}},"awards":{"type":"array","items":{"type":"object","properties":{"awardName":{"type":"string"},"awardDate":{"type":"string"}}}},"tags":{"type":"array","items":{"type":"string"}},"interests":{"type":"string"}}},"html":"<div class=\"resume\">\n  <div class=\"resume-title\">{{resumeTitle}}</div>\n  <div class=\"header\">\n    <h1 class=\"name\">{{name}}</h1>\n    <div class=\"title-tagline\"><span>{{title}}</span></div>\n    <div class=\"contact-row\">\n      <span class=\"contact-item icon-phone\">{{phone}}</span>\n      <span class=\"contact-item icon-email\">{{email}}</span>\n      <span class=\"contact-item icon-location\">{{location}}</span>\n      <span class=\"contact-item\">{{linkedin}}</span>\n    </div>\n    <div class=\"title-divider\"></div>\n  </div>\n  <div>\n    <div class=\"section-title\">核心优势</div>\n    <p class=\"summary\">{{summary}}</p>\n  </div>\n  <div>\n    <div class=\"section-title\">专业经历</div>\n    {{#each experiences}}<div class=\"experience-item\">\n      <div class=\"exp-header\"><span><span class=\"company-name\">{{company}}</span><span class=\"job-title\">｜ {{role}}</span></span><span class=\"date-location\">{{date}} | {{location}}</span></div>\n      <ul class=\"bullet-list\">{{#each bullets}}<li>{{.}}</li>{{/each}}</ul>\n    </div>{{/each}}\n  </div>\n  <div>\n    <div class=\"section-title\">教育背景</div>\n    {{#each education}}<div class=\"education-row\"><span class=\"edu-degree\">{{degree}}</span><span class=\"edu-school\">{{school}}</span><span class=\"edu-date\">{{date}}</span></div>{{/each}}\n  </div>\n  <div>\n    <div class=\"section-title\">核心能力</div>\n    <div class=\"skill-tags\">{{#each skills}}<div class=\"skill-cat\"><span class=\"skill-category\">{{category}}：</span><span class=\"skill-list\">{{#each items}}<span class=\"skill-item\">{{.}}</span>{{/each}}</span></div>{{/each}}</div>\n  </div>\n  <div>\n    <div class=\"section-title\">代表项目</div>\n    {{#each projects}}<div class=\"project-item\">\n      <div class=\"project-head\"><span class=\"project-name\">{{projectName}}</span><span class=\"project-role\">{{projectRole}}</span><span class=\"project-date\">{{projectDate}}</span></div>\n      <ul class=\"bullet-list\">{{#each bullets}}<li>{{.}}</li>{{/each}}</ul>\n    </div>{{/each}}\n  </div>\n  <div class=\"misc-line\">\n    <span><strong>语言：</strong>{{#each languages}}<span class=\"lang\">{{.}}</span>{{/each}}</span>\n    <span><strong>认证：</strong>{{#each certifications}}<span class=\"cert\">{{certName}}</span>{{/each}}</span>\n  </div>\n</div>","css":".resume{--deep-teal: #1A3C34;    \n      --navy-shadow: #0F2A3F;  \n      --soft-slate: #F5F7FA;   \n      --accent-bronze: #B8864A; \n      --text-primary: #1E2B32;  \n      --text-secondary: #3A4952; \n      --divider: #DCE3E8;       \n      --white-pure: #FFFFFF;\n      --page-width: 210mm;\n      --page-height: 297mm;\n      --margin-h: 0.7in;\n      --margin-v: 0.7in;}\n.resume{width: var(--page-width);\n      min-height: var(--page-height);\n      background: var(--white-pure);\n      margin: 0 auto;\n      box-shadow: 0 12px 30px rgba(0, 0, 0, 0.12);\n      padding: var(--margin-v) var(--margin-h);\n      font-family: 'Arial', 'Helvetica Neue', 'Calibri', '思源黑体', 'Source Han Sans SC', sans-serif;\n      color: var(--text-primary);\n      line-height: 1.5;\n      display: flex;\n      flex-direction: column;\n      position: relative;\n      page-break-after: avoid;\n      page-break-inside: avoid;}\n.resume h1, .resume h2, .resume h3, .section-title, .name{font-family: 'Arial', 'Helvetica Neue', 'Calibri', '思源黑体', 'Source Han Sans SC', sans-serif;\n      font-weight: 600;\n      letter-spacing: -0.2px;}\n.header{margin-bottom: 0.45in;\n      display: flex;\n      flex-direction: column;}\n.name{font-size: 28pt;\n      font-weight: 700;\n      color: var(--deep-teal);\n      letter-spacing: 0.8px;\n      line-height: 1.1;\n      margin-bottom: 6px;}\n.title-tagline{font-size: 11.5pt;\n      color: var(--text-secondary);\n      font-weight: 400;\n      margin-bottom: 12px;\n      display: flex;\n      align-items: center;\n      flex-wrap: wrap;\n      gap: 16px;}\n.title-tagline span{display: inline-flex;\n      align-items: center;\n      gap: 6px;\n      color: #2E4A42;}\n.contact-row{display: flex;\n      flex-wrap: wrap;\n      gap: 20px;\n      font-size: 10.5pt;\n      color: var(--text-secondary);\n      margin-top: 10px;\n      align-items: center;}\n.contact-item{display: inline-flex;\n      align-items: center;\n      gap: 5px;\n      white-space: nowrap;}\n.icon-phone::before{content: \"📞\";\n      font-size: 10pt;\n      margin-right: 2px;\n      color: #3A5A4E;}\n.icon-email::before{content: \"✉️\";\n      font-size: 10pt;\n      margin-right: 2px;\n      color: #3A5A4E;}\n.icon-location::before{content: \"📍\";\n      font-size: 10pt;\n      margin-right: 2px;\n      color: #3A5A4E;}\n.title-divider{height: 2px;\n      background: var(--divider);\n      margin-top: 10px;\n      position: relative;\n      width: 100%;}\n.title-divider::before{content: '';\n      position: absolute;\n      left: 0;\n      top: -2px;\n      width: 0.55in;\n      height: 4px;\n      background: var(--deep-teal);}\n.section-title{font-size: 11.5pt;\n      font-weight: 700;\n      color: var(--deep-teal);\n      text-transform: uppercase;\n      letter-spacing: 1.2px;\n      margin: 0.35in 0 0.15in 0;\n      padding-bottom: 5px;\n      border-bottom: 1.5px solid var(--divider);\n      position: relative;\n      display: flex;\n      align-items: center;}\n.section-title::after{content: '';\n      display: inline-block;\n      width: 22px;\n      height: 1.5px;\n      background: var(--accent-bronze);\n      margin-left: 10px;}\n.experience-item{margin-bottom: 0.22in;}\n.exp-header{display: flex;\n      justify-content: space-between;\n      align-items: baseline;\n      flex-wrap: wrap;\n      margin-bottom: 4px;}\n.company-name{font-weight: 700;\n      font-size: 12pt;\n      color: var(--navy-shadow);}\n.job-title{font-weight: 600;\n      font-size: 11pt;\n      color: var(--text-primary);\n      margin-left: 8px;\n      font-style: normal;}\n.date-location{font-size: 10pt;\n      color: var(--text-secondary);\n      font-weight: 400;\n      white-space: nowrap;\n      margin-left: auto;}\n.bullet-list{list-style: none;\n      margin-top: 6px;\n      padding-left: 0;}\n.bullet-list li{font-size: 10.5pt;\n      color: var(--text-primary);\n      margin-bottom: 5px;\n      display: flex;\n      align-items: baseline;\n      gap: 8px;\n      line-height: 1.45;}\n.bullet-list li::before{content: \"•\";\n      color: var(--deep-teal);\n      font-weight: 700;\n      font-size: 13pt;\n      display: inline-block;\n      width: 16px;\n      flex-shrink: 0;}\n.skill-tags{display: flex;\n      flex-wrap: wrap;\n      gap: 10px 16px;\n      margin-top: 8px;}\n.skill-category{font-weight: 700;\n      font-size: 10.5pt;\n      color: var(--navy-shadow);\n      margin-right: 6px;}\n.skill-list{font-size: 10.5pt;\n      color: var(--text-primary);\n      display: flex;\n      flex-wrap: wrap;\n      gap: 6px 12px;\n      align-items: center;}\n.skill-item{background: transparent;\n      padding: 2px 0;\n      border-bottom: 1px dotted var(--divider);\n      white-space: nowrap;}\n.education-row{display: flex;\n      justify-content: space-between;\n      align-items: baseline;\n      font-size: 10.5pt;\n      margin-bottom: 6px;}\n.edu-degree{font-weight: 700;\n      color: var(--navy-shadow);}\n.edu-school{font-weight: 600;\n      color: var(--text-primary);}\n.edu-date{color: var(--text-secondary);\n      margin-left: auto;}\n.resume hr{border: 0;\n      border-top: 1px solid var(--divider);\n      margin: 8px 0 12px;}\n.resume{position: relative;\n      border-left: 5px solid var(--deep-teal);}\n.resume p, .resume li, .resume span, .resume div{user-select: text;}\n\n.resume-title{font-size:9pt;text-align:center;letter-spacing:0.12em;color:#2E4A42;margin-bottom:8px}.summary{font-size:10.5pt;color:#2E3B3A;margin:6px 0 10px}.skill-cat{width:100%;display:flex;flex-wrap:wrap;align-items:baseline;margin-bottom:6px}.project-item{margin-bottom:0.25in}.project-head{display:flex;align-items:baseline;gap:12px;flex-wrap:wrap;font-size:10.5pt;margin-bottom:6px}.project-name{font-weight:700;color:#0F2A3F}.project-role{color:#3A4952}.project-date{margin-left:auto;color:#3A4952}.misc-line{display:flex;gap:30px;font-size:10pt;color:#2E3B3A;border-top:1px solid #DCE3E8;padding-top:12px;margin-top:0.25in}.misc-line strong{color:#1A3C34}.lang,.cert{margin-right:8px}"}