{"code":"p11","name":"极简灰度数据科学","description":"等宽字体+灰度极简，短横线要点，适合数据科学与算法岗。","schema":{"type":"object","required":["name"],"properties":{"name":{"type":"string"},"title":{"type":"string"},"phone":{"type":"string"},"email":{"type":"string"},"location":{"type":"string"},"linkedin":{"type":"string"},"website":{"type":"string"},"summary":{"type":"string"},"experiences":{"type":"array","items":{"type":"object","properties":{"company":{"type":"string"},"role":{"type":"string"},"date":{"type":"string"},"location":{"type":"string"},"bullets":{"type":"array","items":{"type":"string"}}}}},"education":{"type":"array","items":{"type":"object","properties":{"school":{"type":"string"},"degree":{"type":"string"},"date":{"type":"string"},"location":{"type":"string"}}}},"skills":{"type":"array","items":{"type":"object","properties":{"category":{"type":"string"},"items":{"type":"array","items":{"type":"string"}}}}},"projects":{"type":"array","items":{"type":"object","properties":{"projectName":{"type":"string"},"projectRole":{"type":"string"},"projectDate":{"type":"string"},"stack":{"type":"string"},"bullets":{"type":"array","items":{"type":"string"}}}}},"certifications":{"type":"array","items":{"type":"object","properties":{"certName":{"type":"string"},"certDate":{"type":"string"}}}},"languages":{"type":"array","items":{"type":"string"}},"awards":{"type":"array","items":{"type":"object","properties":{"awardName":{"type":"string"},"awardDate":{"type":"string"}}}},"tags":{"type":"array","items":{"type":"string"}},"interests":{"type":"string"}}},"html":"<div class=\"resume\">\n  <div class=\"resume-title\">{{resumeTitle}}</div>\n  <div class=\"header\">\n    <div class=\"name\">{{name}}</div>\n    <div class=\"title-line\"><span>{{title}}</span><span>{{linkedin}}</span></div>\n    <div class=\"contact-row\">\n      <span class=\"contact-item\"><span class=\"icon\">☎</span>{{phone}}</span>\n      <span class=\"contact-item\"><span class=\"icon\">✉</span>{{email}}</span>\n      <span class=\"contact-item\"><span class=\"icon\">⛓</span>{{linkedin}}</span>\n      <span class=\"contact-item\"><span class=\"icon\">⌘</span>{{website}}</span>\n    </div>\n  </div>\n  <div><div class=\"section-title\">专业摘要</div><p class=\"summary\">{{summary}}</p></div>\n  <div><div class=\"section-title\">核心技术</div><div class=\"skills-container\">{{#each tags}}<span class=\"skill-tag\">{{.}}</span>{{/each}}</div></div>\n  <div>\n    <div class=\"section-title\">工作经历</div>\n    {{#each experiences}}<div class=\"entry\">\n      <div class=\"entry-header\"><span class=\"entry-left\">{{company}} · {{role}}</span><span class=\"entry-right\">{{date}}</span></div>\n      <div class=\"entry-sub\">{{location}}</div>\n      <ul class=\"desc-list\">{{#each bullets}}<li>{{.}}</li>{{/each}}</ul>\n    </div>{{/each}}\n  </div>\n  <div>\n    <div class=\"section-title\">重点项目</div>\n    {{#each projects}}<div class=\"project-item\">\n      <div class=\"project-name\"><span>{{projectName}}</span><span>{{projectRole}}</span></div>\n      <div class=\"project-desc\">{{#each bullets}}<div>{{.}}</div>{{/each}}</div>\n    </div>{{/each}}\n  </div>\n  <div>\n    <div class=\"section-title\">教育背景</div>\n    {{#each education}}<div class=\"edu-row\"><span class=\"edu-left\">{{school}}</span><span class=\"edu-right\">{{date}}</span></div><div class=\"edu-note\">{{degree}}</div>{{/each}}\n  </div>\n  <div>\n    <div class=\"section-title\">语言与认证</div>\n    <div class=\"two-col\">\n      <div class=\"col\">{{#each languages}}<p><span class=\"cert-label\">{{.}}</span></p>{{/each}}</div>\n      <div class=\"col\">{{#each certifications}}<p><span class=\"cert-label\">{{certName}}</span> <span>{{certDate}}</span></p>{{/each}}</div>\n    </div>\n  </div>\n</div>","css":".resume{width: 210mm;\n      min-height: 297mm;\n      background: #ffffff;\n      box-shadow: 0 12px 40px rgba(0,0,0,0.5);\n      padding: 17mm 18mm 17mm 18mm; \n      display: flex;\n      flex-direction: column;\n      gap: 0.8rem;\n      page-break-after: avoid;\n      page-break-inside: avoid;}\n.resume h1, .resume h2, .resume h3, .resume p, .resume li, .resume div, .resume span{font-family: 'Courier New', 'SF Mono', 'Menlo', 'Consolas', '思源黑体', 'Noto Sans SC', monospace;}\n.header{margin-bottom: 0.4rem;\n      border-bottom: 1.5px solid #4a4a4a;\n      padding-bottom: 0.9rem;}\n.name{font-size: 2.5rem;\n      font-weight: 600;\n      letter-spacing: 2px;\n      color: #1e1e1e;\n      line-height: 1.2;\n      margin-bottom: 0.25rem;}\n.title-line{font-size: 1rem;\n      font-weight: 400;\n      color: #5a5a5a;\n      letter-spacing: 1px;\n      display: flex;\n      flex-wrap: wrap;\n      justify-content: space-between;\n      align-items: baseline;\n      margin-top: 0.2rem;}\n.contact-row{display: flex;\n      flex-wrap: wrap;\n      gap: 1.8rem;\n      font-size: 0.8rem;\n      color: #4a4a4a;\n      margin-top: 0.4rem;\n      align-items: center;}\n.contact-item{display: flex;\n      align-items: center;\n      gap: 0.3rem;}\n.icon{font-size: 0.9rem;\n      color: #3a3a3a;\n      font-weight: 500;}\n.section-title{font-size: 0.9rem;\n      font-weight: 700;\n      letter-spacing: 2.5px;\n      text-transform: uppercase;\n      color: #2b2b2b;\n      border-bottom: 1px solid #b0b0b0;\n      padding-bottom: 0.25rem;\n      margin-bottom: 0.7rem;\n      margin-top: 0.5rem;}\n.entry{margin-bottom: 0.75rem;}\n.entry-header{display: flex;\n      justify-content: space-between;\n      align-items: baseline;\n      flex-wrap: wrap;\n      margin-bottom: 0.15rem;}\n.entry-left{font-weight: 700;\n      font-size: 1rem;\n      color: #1e1e1e;}\n.entry-right{font-size: 0.8rem;\n      color: #5a5a5a;\n      font-weight: 500;\n      white-space: nowrap;}\n.entry-sub{font-size: 0.9rem;\n      color: #3a3a3a;\n      margin-bottom: 0.25rem;\n      font-style: italic;\n      font-weight: 500;}\n.desc-list{list-style: none;\n      padding-left: 0;\n      margin-top: 0.2rem;}\n.desc-list li{font-size: 0.8rem;\n      color: #2d2d2d;\n      margin-bottom: 0.18rem;\n      display: flex;\n      align-items: baseline;\n      gap: 0.4rem;}\n.desc-list li::before{content: \"–\";  \n      color: #606060;\n      font-weight: 600;\n      display: inline-block;\n      width: 0.9rem;\n      text-align: center;\n      flex-shrink: 0;}\n.skills-container{display: flex;\n      flex-wrap: wrap;\n      gap: 0.5rem;\n      margin-top: 0.3rem;}\n.skill-tag{background: #f0f0f0;\n      color: #1e1e1e;\n      padding: 0.15rem 0.7rem;\n      font-size: 0.75rem;\n      border: 1px solid #c0c0c0;\n      letter-spacing: 0.3px;\n      font-weight: 500;}\n.two-col{display: flex;\n      gap: 1.8rem;\n      margin-top: 0.2rem;}\n.col{flex: 1;}\n.col p{font-size: 0.8rem;\n      margin-bottom: 0.25rem;\n      display: flex;\n      justify-content: space-between;}\n.project-item{margin-bottom: 0.6rem;}\n.project-name{font-weight: 700;\n      font-size: 0.9rem;\n      color: #1e1e1e;\n      display: flex;\n      justify-content: space-between;}\n.project-desc{font-size: 0.8rem;\n      color: #3a3a3a;\n      margin-top: 0.1rem;}\n.resume hr{border: none;\n      border-top: 1px solid #d0d0d0;\n      margin: 0.4rem 0 0.7rem 0;}\n\n.resume{font-family:\"Courier New\",\"Source Code Pro\",\"Menlo\",\"Consolas\",\"思源黑体\",\"Noto Sans SC\",monospace;color:#2d2d2d;line-height:1.5}.resume-title{font-size:9pt;letter-spacing:0.15em;color:#5a5a5a;margin-bottom:8px}.summary{font-size:0.8rem;color:#2d2d2d;line-height:1.5}.edu-row{display:flex;justify-content:space-between;align-items:baseline;flex-wrap:wrap}.edu-left{font-weight:700;font-size:0.9rem}.edu-right{font-size:0.8rem;color:#4a4a4a}.edu-note{font-size:0.8rem;color:#3a3a3a;margin-bottom:0.2rem}.cert-label{font-weight:600}"}